From	To	crc_hash	source	description
O15197	O15197	CRC-BF1D4D9BE34358A5	query	sp|O15197|EPHB6_HUMAN Ephrin type-B receptor 6 OS=Homo sapiens OX=9606 GN=EPHB6 PE=1 SV=4
Q49AN0	Q49AN0	CRC-BF380424092BEBFB	query	sp|Q49AN0|CRY2_HUMAN Cryptochrome-2 OS=Homo sapiens OX=9606 GN=CRY2 PE=1 SV=2
P17612	P17612	CRC-BF6D3ECD2614E5AB	query	sp|P17612|KAPCA_HUMAN cAMP-dependent protein kinase catalytic subunit alpha OS=Homo sapiens OX=9606 GN=PRKACA PE=1 SV=2
Q9BXW9	Q9BXW9	CRC-BF931980ADA67405	query	sp|Q9BXW9|FACD2_HUMAN Fanconi anemia group D2 protein OS=Homo sapiens OX=9606 GN=FANCD2 PE=1 SV=2
P18206	P18206	CRC-BFBD687DA836B0FA	query	sp|P18206|VINC_HUMAN Vinculin OS=Homo sapiens OX=9606 GN=VCL PE=1 SV=4
Q62768	Q62768	CRC-BFE7D0467D258900	query	sp|Q62768|UN13A_RAT Protein unc-13 homolog A OS=Rattus norvegicus OX=10116 GN=Unc13a PE=1 SV=1
P0AC30	P0AC30	CRC-C006ED56043739AE	query	sp|P0AC30|FTSX_ECOLI Cell division protein FtsX OS=Escherichia coli (strain K12) OX=83333 GN=ftsX PE=1 SV=1
Q9CZA6	Q9CZA6	CRC-C0A339C4F51EF8D9	query	sp|Q9CZA6|NDE1_MOUSE Nuclear distribution protein nudE homolog 1 OS=Mus musculus OX=10090 GN=Nde1 PE=1 SV=1
P03995	P03995	CRC-C0FB500AE1588377	query	sp|P03995|GFAP_MOUSE Glial fibrillary acidic protein OS=Mus musculus OX=10090 GN=Gfap PE=1 SV=4
P51452	P51452	CRC-C1045DD9B226FD94	query	sp|P51452|DUS3_HUMAN Dual specificity protein phosphatase 3 OS=Homo sapiens OX=9606 GN=DUSP3 PE=1 SV=1
Q00688	Q00688	CRC-C144C5AAB7EA9522	query	sp|Q00688|FKBP3_HUMAN Peptidyl-prolyl cis-trans isomerase FKBP3 OS=Homo sapiens OX=9606 GN=FKBP3 PE=1 SV=1
Q6R0H7	Q6R0H7	CRC-C1497D45498172F7	query	sp|Q6R0H7|GNAS1_MOUSE Guanine nucleotide-binding protein G(s) subunit alpha isoforms XLas OS=Mus musculus OX=10090 GN=Gnas PE=1 SV=1
Q80T23	Q80T23	CRC-C1560AB677818B57	query	sp|Q80T23|SYTL5_MOUSE Synaptotagmin-like protein 5 OS=Mus musculus OX=10090 GN=Sytl5 PE=1 SV=1
P37455	P37455	CRC-C170025FBDACDC5D	query	sp|P37455|SSBA_BACSU Single-stranded DNA-binding protein A OS=Bacillus subtilis (strain 168) OX=224308 GN=ssbA PE=1 SV=1
O04291	O04291	CRC-C1802529EFCC4E68	query	sp|O04291|ATB14_ARATH Homeobox-leucine zipper protein ATHB-14 OS=Arabidopsis thaliana OX=3702 GN=ATHB-14 PE=1 SV=1
P52735	P52735	CRC-C186911605FD5B73	query	sp|P52735|VAV2_HUMAN Guanine nucleotide exchange factor VAV2 OS=Homo sapiens OX=9606 GN=VAV2 PE=1 SV=2
P12931	P12931	CRC-C1908084683E5DE8	query	sp|P12931|SRC_HUMAN Proto-oncogene tyrosine-protein kinase Src OS=Homo sapiens OX=9606 GN=SRC PE=1 SV=3
P01344	P01344	CRC-C1B0EB1E016BA37A	query	sp|P01344|IGF2_HUMAN Insulin-like growth factor II OS=Homo sapiens OX=9606 GN=IGF2 PE=1 SV=1
P70217	P70217	CRC-C1BD2FAF6D56E533	query	sp|P70217|HXD13_MOUSE Homeobox protein Hox-D13 OS=Mus musculus OX=10090 GN=Hoxd13 PE=1 SV=2
P08174	P08174	CRC-C1CBE5300F60C176	query	sp|P08174|DAF_HUMAN Complement decay-accelerating factor OS=Homo sapiens OX=9606 GN=CD55 PE=1 SV=4
Q13075	Q13075	CRC-C1CE163D55900C6D	query	sp|Q13075|BIRC1_HUMAN Baculoviral IAP repeat-containing protein 1 OS=Homo sapiens OX=9606 GN=NAIP PE=1 SV=3
Q9UKW4	Q9UKW4	CRC-C1E29F0B094CB721	query	sp|Q9UKW4|VAV3_HUMAN Guanine nucleotide exchange factor VAV3 OS=Homo sapiens OX=9606 GN=VAV3 PE=1 SV=1
P43407	P43407	CRC-C213D1B64D88376F	query	sp|P43407|SDC2_MOUSE Syndecan-2 OS=Mus musculus OX=10090 GN=Sdc2 PE=1 SV=1
P07522	P07522	CRC-C224A302E9578031	query	sp|P07522|EGF_RAT Pro-epidermal growth factor OS=Rattus norvegicus OX=10116 GN=Egf PE=1 SV=2
P54256	P54256	CRC-C23C5CB57520B574	query	sp|P54256|HAP1_RAT Huntingtin-associated protein 1 OS=Rattus norvegicus OX=10116 GN=Hap1 PE=1 SV=1
P0ABH0	P0ABH0	CRC-C2475377A229B982	query	sp|P0ABH0|FTSA_ECOLI Cell division protein FtsA OS=Escherichia coli (strain K12) OX=83333 GN=ftsA PE=1 SV=1
Q96UP3	Q96UP3	CRC-C279D8168CC940F0	query	sp|Q96UP3|RIF1_SCHPO Telomere length regulator protein rif1 OS=Schizosaccharomyces pombe (strain 972 / ATCC 24843) OX=284812 GN=rif1 PE=1 SV=1
Q07955	Q07955	CRC-C28A0B2F112EA713	query	sp|Q07955|SRSF1_HUMAN Serine/arginine-rich splicing factor 1 OS=Homo sapiens OX=9606 GN=SRSF1 PE=1 SV=2
P41593	P41593	CRC-C2E6CCAF2ABAFEEF	query	sp|P41593|PTH1R_MOUSE Parathyroid hormone/parathyroid hormone-related peptide receptor OS=Mus musculus OX=10090 GN=Pth1r PE=1 SV=2
Q9P0N9	Q9P0N9	CRC-C2F35E10F10D00C2	query	sp|Q9P0N9|TBCD7_HUMAN TBC1 domain family member 7 OS=Homo sapiens OX=9606 GN=TBC1D7 PE=1 SV=1
O60674	O60674	CRC-C30669EF1A7DA80C	query	sp|O60674|JAK2_HUMAN Tyrosine-protein kinase JAK2 OS=Homo sapiens OX=9606 GN=JAK2 PE=1 SV=2
Q9NQT4	Q9NQT4	CRC-C3C1FCB39D85B1EE	query	sp|Q9NQT4|EXOS5_HUMAN Exosome complex component RRP46 OS=Homo sapiens OX=9606 GN=EXOSC5 PE=1 SV=1
Q61768	Q61768	CRC-C3D3461A0C314901	query	sp|Q61768|KINH_MOUSE Kinesin-1 heavy chain OS=Mus musculus OX=10090 GN=Kif5b PE=1 SV=3
Q16570	Q16570	CRC-C3F2A3E71D972E2D	query	sp|Q16570|ACKR1_HUMAN Atypical chemokine receptor 1 OS=Homo sapiens OX=9606 GN=ACKR1 PE=1 SV=3
Q9BYV2	Q9BYV2	CRC-C44B08A9871323F6	query	sp|Q9BYV2|TRI54_HUMAN Tripartite motif-containing protein 54 OS=Homo sapiens OX=9606 GN=TRIM54 PE=1 SV=3
Q9WTW1	Q9WTW1	CRC-C463C36ADC459A3C	query	sp|Q9WTW1|GRIP2_RAT Glutamate receptor-interacting protein 2 OS=Rattus norvegicus OX=10116 GN=Grip2 PE=1 SV=1
Q9UHR5	Q9UHR5	CRC-C48CEFBD73CE82BC	query	sp|Q9UHR5|S30BP_HUMAN SAP30-binding protein OS=Homo sapiens OX=9606 GN=SAP30BP PE=1 SV=1
P14646-2	P14646	CRC-C48F576EFA8DF498	query	sp|P14646|PDE4B_RAT cAMP-specific 3',5'-cyclic phosphodiesterase 4B OS=Rattus norvegicus OX=10116 GN=Pde4b PE=1 SV=4
P14646-1	P14646	CRC-C48F576EFA8DF498	query	sp|P14646|PDE4B_RAT cAMP-specific 3',5'-cyclic phosphodiesterase 4B OS=Rattus norvegicus OX=10116 GN=Pde4b PE=1 SV=4
Q71VB4	Q71VB4	CRC-C4A2BDDD4A410C20	query	tr|Q71VB4|Q71VB4_MOUSE PBX1b OS=Mus musculus OX=10090 GN=Pbx1 PE=2 SV=1
P42208	P42208	CRC-C4BFFB3F1815E081	query	sp|P42208|SEPT2_MOUSE Septin-2 OS=Mus musculus OX=10090 GN=Septin2 PE=1 SV=2
P61586	P61586	CRC-C4DA2DC31FF858BC	query	sp|P61586|RHOA_HUMAN Transforming protein RhoA OS=Homo sapiens OX=9606 GN=RHOA PE=1 SV=1
Q12933	Q12933	CRC-C508BE185B783B20	query	sp|Q12933|TRAF2_HUMAN TNF receptor-associated factor 2 OS=Homo sapiens OX=9606 GN=TRAF2 PE=1 SV=2
Q62824	Q62824	CRC-C52FD3553BE75858	query	sp|Q62824|EXOC4_RAT Exocyst complex component 4 OS=Rattus norvegicus OX=10116 GN=Exoc4 PE=1 SV=1
P08956	P08956	CRC-C5B90A799C455318	query	sp|P08956|T1RK_ECOLI Type I restriction enzyme EcoKI endonuclease subunit OS=Escherichia coli (strain K12) OX=83333 GN=hsdR PE=1 SV=3
P04150	P04150	CRC-C5C90C9A5DD16AAB	query	sp|P04150|GCR_HUMAN Glucocorticoid receptor OS=Homo sapiens OX=9606 GN=NR3C1 PE=1 SV=1
Q61501	Q61501	CRC-C5DF18AD3B4DFEFA	query	sp|Q61501|E2F1_MOUSE Transcription factor E2F1 OS=Mus musculus OX=10090 GN=E2f1 PE=1 SV=1
P67775	P67775	CRC-C602291F78F34555	query	sp|P67775|PP2AA_HUMAN Serine/threonine-protein phosphatase 2A catalytic subunit alpha isoform OS=Homo sapiens OX=9606 GN=PPP2CA PE=1 SV=1
Q5U2T9	Q5U2T9	CRC-C63929D7A5FF2B85	query	tr|Q5U2T9|Q5U2T9_RAT peptidylprolyl isomerase OS=Rattus norvegicus OX=10116 GN=Fkbp5 PE=2 SV=1
P42229	P42229	CRC-C64237295F88CFBE	query	sp|P42229|STA5A_HUMAN Signal transducer and activator of transcription 5A OS=Homo sapiens OX=9606 GN=STAT5A PE=1 SV=1
P32971	P32971	CRC-C653615682305B1B	query	sp|P32971|TNFL8_HUMAN Tumor necrosis factor ligand superfamily member 8 OS=Homo sapiens OX=9606 GN=TNFSF8 PE=1 SV=1
P62960	P62960	CRC-C6667CF7CA10D45D	query	sp|P62960|YBOX1_MOUSE Y-box-binding protein 1 OS=Mus musculus OX=10090 GN=Ybx1 PE=1 SV=3
Q9ERI2	Q9ERI2	CRC-C6857EBDD7F38137	query	sp|Q9ERI2|RB27A_MOUSE Ras-related protein Rab-27A OS=Mus musculus OX=10090 GN=Rab27a PE=1 SV=1
Q07889	Q07889	CRC-C6B99CCA11A8DE45	query	sp|Q07889|SOS1_HUMAN Son of sevenless homolog 1 OS=Homo sapiens OX=9606 GN=SOS1 PE=1 SV=1
P04401	P04401	CRC-C6DC091682452AF4	query	sp|P04401|IL5_MOUSE Interleukin-5 OS=Mus musculus OX=10090 GN=Il5 PE=1 SV=1
Q9BYM8	Q9BYM8	CRC-C6EF957B1F152FF2	query	sp|Q9BYM8|HOIL1_HUMAN RanBP-type and C3HC4-type zinc finger-containing protein 1 OS=Homo sapiens OX=9606 GN=RBCK1 PE=1 SV=2
P46939	P46939	CRC-C72CADE8CD666993	query	sp|P46939|UTRN_HUMAN Utrophin OS=Homo sapiens OX=9606 GN=UTRN PE=1 SV=2
P27512	P27512	CRC-C7970DAD2FEA534A	query	sp|P27512|TNR5_MOUSE Tumor necrosis factor receptor superfamily member 5 OS=Mus musculus OX=10090 GN=Cd40 PE=1 SV=3
Q4GWZ2	Q4GWZ2	CRC-C7C8DAA6B7459785	query	sp|Q4GWZ2|RSSA_PIG 40S ribosomal protein SA OS=Sus scrofa OX=9823 GN=RPSA PE=1 SV=3
P13861	P13861	CRC-C7D6E8E476E1DB65	query	sp|P13861|KAP2_HUMAN cAMP-dependent protein kinase type II-alpha regulatory subunit OS=Homo sapiens OX=9606 GN=PRKAR2A PE=1 SV=2
O60784	O60784	CRC-C7D77B5669476242	query	sp|O60784|TOM1_HUMAN Target of Myb1 membrane trafficking protein OS=Homo sapiens OX=9606 GN=TOM1 PE=1 SV=2
P43004	P43004	CRC-C8104E6727979435	query	sp|P43004|EAA2_HUMAN Excitatory amino acid transporter 2 OS=Homo sapiens OX=9606 GN=SLC1A2 PE=1 SV=2
P42702	P42702	CRC-C8602897E359FCE5	query	sp|P42702|LIFR_HUMAN Leukemia inhibitory factor receptor OS=Homo sapiens OX=9606 GN=LIFR PE=1 SV=1
O75528	O75528	CRC-C86153CFA83F9226	query	sp|O75528|TADA3_HUMAN Transcriptional adapter 3 OS=Homo sapiens OX=9606 GN=TADA3 PE=1 SV=1
P23769	P23769	CRC-C879CC932C355E6A	query	sp|P23769|GATA2_HUMAN Endothelial transcription factor GATA-2 OS=Homo sapiens OX=9606 GN=GATA2 PE=1 SV=3
P10827	P10827	CRC-C87C7D2F67B1AE49	query	sp|P10827|THA_HUMAN Thyroid hormone receptor alpha OS=Homo sapiens OX=9606 GN=THRA PE=1 SV=1
P0AD68	P0AD68	CRC-C89A403D5980B2CD	query	sp|P0AD68|FTSI_ECOLI Peptidoglycan D,D-transpeptidase FtsI OS=Escherichia coli (strain K12) OX=83333 GN=ftsI PE=1 SV=1
P31041	P31041	CRC-C8E1339DD7E53CA6	query	sp|P31041|CD28_MOUSE T-cell-specific surface glycoprotein CD28 OS=Mus musculus OX=10090 GN=Cd28 PE=1 SV=2
P06400	P06400	CRC-C8E746111E19CC32	query	sp|P06400|RB_HUMAN Retinoblastoma-associated protein OS=Homo sapiens OX=9606 GN=RB1 PE=1 SV=2
Q60948	Q60948	CRC-C8FB5A56AFE3B27C	query	sp|Q60948|MAD4_MOUSE Max dimerization protein 4 OS=Mus musculus OX=10090 GN=Mxd4 PE=1 SV=1
O35717	O35717	CRC-C9051AE9C84BA7F5	query	sp|O35717|SOCS2_MOUSE Suppressor of cytokine signaling 2 OS=Mus musculus OX=10090 GN=Socs2 PE=1 SV=1
Q91V27	Q91V27	CRC-C91444B16B8EFA1D	query	sp|Q91V27|MELPH_MOUSE Melanophilin OS=Mus musculus OX=10090 GN=Mlph PE=1 SV=1
P08081	P08081	CRC-C939E85B0FD2E124	query	sp|P08081|CLCA_RAT Clathrin light chain A OS=Rattus norvegicus OX=10116 GN=Clta PE=1 SV=1
P25205	P25205	CRC-C967C068B7090558	query	sp|P25205|MCM3_HUMAN DNA replication licensing factor MCM3 OS=Homo sapiens OX=9606 GN=MCM3 PE=1 SV=3
P97465	P97465	CRC-C999C9FE0DA58EA3	query	sp|P97465|DOK1_MOUSE Docking protein 1 OS=Mus musculus OX=10090 GN=Dok1 PE=1 SV=2
P04840	P04840	CRC-C99D03711AF9B54D	query	sp|P04840|VDAC1_YEAST Mitochondrial outer membrane protein porin 1 OS=Saccharomyces cerevisiae (strain ATCC 204508 / S288c) OX=559292 GN=POR1 PE=1 SV=4
P78396	P78396	CRC-C9C023EEA1CF036D	query	sp|P78396|CCNA1_HUMAN Cyclin-A1 OS=Homo sapiens OX=9606 GN=CCNA1 PE=1 SV=1
P04406	P04406	CRC-C9C135E8AE3E8744	query	sp|P04406|G3P_HUMAN Glyceraldehyde-3-phosphate dehydrogenase OS=Homo sapiens OX=9606 GN=GAPDH PE=1 SV=3
O75175	O75175	CRC-C9D4F8B9FEF6CD90	query	sp|O75175|CNOT3_HUMAN CCR4-NOT transcription complex subunit 3 OS=Homo sapiens OX=9606 GN=CNOT3 PE=1 SV=1
Q00597	Q00597	CRC-C9DDFFAC725D050C	query	sp|Q00597|FANCC_HUMAN Fanconi anemia group C protein OS=Homo sapiens OX=9606 GN=FANCC PE=1 SV=1
Q06481	Q06481	CRC-CA3A7D6DDB8A28D0	query	sp|Q06481|APLP2_HUMAN Amyloid beta precursor like protein 2 OS=Homo sapiens OX=9606 GN=APLP2 PE=1 SV=2
D3ZWB1	D3ZWB1	CRC-CA3E6E67454E7465	query	tr|D3ZWB1|D3ZWB1_RAT U6 snRNA-associated Sm-like protein LSm1 OS=Rattus norvegicus OX=10116 GN=Lsm1 PE=3 SV=1
Q9P1Z0	Q9P1Z0	CRC-CA4AB6A5230C2F52	query	sp|Q9P1Z0|ZBTB4_HUMAN Zinc finger and BTB domain-containing protein 4 OS=Homo sapiens OX=9606 GN=ZBTB4 PE=1 SV=3
P35523	P35523	CRC-CA838BCD2AF3CA68	query	sp|P35523|CLCN1_HUMAN Chloride channel protein 1 OS=Homo sapiens OX=9606 GN=CLCN1 PE=1 SV=3
Q15276	Q15276	CRC-CAAF91638B8ED516	query	sp|Q15276|RABE1_HUMAN Rab GTPase-binding effector protein 1 OS=Homo sapiens OX=9606 GN=RABEP1 PE=1 SV=2
Q9BUB5	Q9BUB5	CRC-CAE225C35DCB2B43	query	sp|Q9BUB5|MKNK1_HUMAN MAP kinase-interacting serine/threonine-protein kinase 1 OS=Homo sapiens OX=9606 GN=MKNK1 PE=1 SV=1
Q9CZB6	Q9CZB6	CRC-CB340CCF5770541C	query	sp|Q9CZB6|MED7_MOUSE Mediator of RNA polymerase II transcription subunit 7 OS=Mus musculus OX=10090 GN=Med7 PE=1 SV=2
Q9Z136	Q9Z136	CRC-CB5AE6A12AE3B0A1	query	sp|Q9Z136|TSC1_RAT Hamartin OS=Rattus norvegicus OX=10116 GN=Tsc1 PE=1 SV=1
O35984	O35984	CRC-CB6B71A6FE207E8D	query	sp|O35984|PBX2_MOUSE Pre-B-cell leukemia transcription factor 2 OS=Mus musculus OX=10090 GN=Pbx2 PE=1 SV=1
P35222	P35222	CRC-CB78F165A3EEF86E	query	sp|P35222|CTNB1_HUMAN Catenin beta-1 OS=Homo sapiens OX=9606 GN=CTNNB1 PE=1 SV=1
Q9ULX6	Q9ULX6	CRC-CBC265BF25996BA2	query	sp|Q9ULX6|AKP8L_HUMAN A-kinase anchor protein 8-like OS=Homo sapiens OX=9606 GN=AKAP8L PE=1 SV=4
P01583	P01583	CRC-CBCCC49569D9ED40	query	sp|P01583|IL1A_HUMAN Interleukin-1 alpha OS=Homo sapiens OX=9606 GN=IL1A PE=1 SV=1
O43823	O43823	CRC-CBCD5F014FD94B66	query	sp|O43823|AKAP8_HUMAN A-kinase anchor protein 8 OS=Homo sapiens OX=9606 GN=AKAP8 PE=1 SV=1
P63006	P63006	CRC-CC8637984998ADAF	query	sp|P63006|LHX1_MOUSE LIM/homeobox protein Lhx1 OS=Mus musculus OX=10090 GN=Lhx1 PE=1 SV=1
Q13232	Q13232	CRC-CCA41A122A37202D	query	sp|Q13232|NDK3_HUMAN Nucleoside diphosphate kinase 3 OS=Homo sapiens OX=9606 GN=NME3 PE=1 SV=2
Q8AZK7	Q8AZK7	CRC-CD2C6C3B737AC1E9	query	sp|Q8AZK7|EBNA5_EBVB9 Epstein-Barr nuclear antigen leader protein OS=Epstein-Barr virus (strain B95-8) OX=10377 GN=EBNA-LP PE=1 SV=1
O35718	O35718	CRC-CD3859561D4CCDED	query	sp|O35718|SOCS3_MOUSE Suppressor of cytokine signaling 3 OS=Mus musculus OX=10090 GN=Socs3 PE=1 SV=1
P0A6F5	P0A6F5	CRC-CD3A0FB505F74AD1	query	sp|P0A6F5|CH60_ECOLI Chaperonin GroEL OS=Escherichia coli (strain K12) OX=83333 GN=groEL PE=1 SV=2
P63092	P63092	CRC-CD541181FC4412EF	query	sp|P63092|GNAS2_HUMAN Guanine nucleotide-binding protein G(s) subunit alpha isoforms short OS=Homo sapiens OX=9606 GN=GNAS PE=1 SV=1
Q9QPN3	Q9QPN3	CRC-CD61DFA6F386CC89	query	sp|Q9QPN3|NEF_HV1LA Protein Nef (Fragment) OS=Human immunodeficiency virus type 1 group M subtype B (isolate Lai) OX=290579 GN=nef PE=1 SV=3
Q62725	Q62725	CRC-CD663F057DF7B6A6	query	sp|Q62725|NFYC_RAT Nuclear transcription factor Y subunit gamma OS=Rattus norvegicus OX=10116 GN=Nfyc PE=2 SV=1
Q9NRA1	Q9NRA1	CRC-CDE9E51F40633E78	query	sp|Q9NRA1|PDGFC_HUMAN Platelet-derived growth factor C OS=Homo sapiens OX=9606 GN=PDGFC PE=1 SV=2
Q05586	Q05586	CRC-CDF5402769E530AB	query	sp|Q05586|NMDZ1_HUMAN Glutamate receptor ionotropic, NMDA 1 OS=Homo sapiens OX=9606 GN=GRIN1 PE=1 SV=1
O70355	O70355	CRC-CE09E537F72CF123	query	sp|O70355|BTNL2_MOUSE Butyrophilin-like protein 2 OS=Mus musculus OX=10090 GN=Btnl2 PE=1 SV=2
Q92990	Q92990	CRC-CE19050F1F692378	query	sp|Q92990|GLMN_HUMAN Glomulin OS=Homo sapiens OX=9606 GN=GLMN PE=1 SV=2
Q9UBF6	Q9UBF6	CRC-CE1E6CAC940C8257	query	sp|Q9UBF6|RBX2_HUMAN RING-box protein 2 OS=Homo sapiens OX=9606 GN=RNF7 PE=1 SV=1
Q9Y2Q0	Q9Y2Q0	CRC-CE1EAF0206CD36F7	query	sp|Q9Y2Q0|AT8A1_HUMAN Phospholipid-transporting ATPase IA OS=Homo sapiens OX=9606 GN=ATP8A1 PE=1 SV=1
Q99613	Q99613	CRC-CE5029F4EB51C1AA	query	sp|Q99613|EIF3C_HUMAN Eukaryotic translation initiation factor 3 subunit C OS=Homo sapiens OX=9606 GN=EIF3C PE=1 SV=1
P51531	P51531	CRC-CE69BBB287D35AB5	query	sp|P51531|SMCA2_HUMAN Probable global transcription activator SNF2L2 OS=Homo sapiens OX=9606 GN=SMARCA2 PE=1 SV=2
O75360	O75360	CRC-CE6D59B3D295A86D	query	sp|O75360|PROP1_HUMAN Homeobox protein prophet of Pit-1 OS=Homo sapiens OX=9606 GN=PROP1 PE=1 SV=2
Q99JI6	Q99JI6	CRC-CE976895E5965224	query	sp|Q99JI6|RAP1B_MOUSE Ras-related protein Rap-1b OS=Mus musculus OX=10090 GN=Rap1b PE=1 SV=2
P29351	P29351	CRC-CF17300D032638D2	query	sp|P29351|PTN6_MOUSE Tyrosine-protein phosphatase non-receptor type 6 OS=Mus musculus OX=10090 GN=Ptpn6 PE=1 SV=2
Q04047	Q04047	CRC-CFB2F4A35A306D95	query	sp|Q04047|NONA_DROME Protein no-on-transient A OS=Drosophila melanogaster OX=7227 GN=nonA PE=1 SV=2
O08983	O08983	CRC-CFBB610E3F5A7B89	query	sp|O08983|HPS1_MOUSE BLOC-3 complex member HPS1 OS=Mus musculus OX=10090 GN=Hps1 PE=2 SV=2
Q8BN78	Q8BN78	CRC-CFD23E0C15B491D1	query	sp|Q8BN78|KAISO_MOUSE Transcriptional regulator Kaiso OS=Mus musculus OX=10090 GN=Zbtb33 PE=1 SV=1
P63146	P63146	CRC-CFDEEEE7E06840BE	query	sp|P63146|UBE2B_HUMAN Ubiquitin-conjugating enzyme E2 B OS=Homo sapiens OX=9606 GN=UBE2B PE=1 SV=1
P23511	P23511	CRC-D00BE17041EB1A9E	query	sp|P23511|NFYA_HUMAN Nuclear transcription factor Y subunit alpha OS=Homo sapiens OX=9606 GN=NFYA PE=1 SV=2
P97503	P97503	CRC-D089523714C86BA6	query	sp|P97503|NKX32_MOUSE Homeobox protein Nkx-3.2 OS=Mus musculus OX=10090 GN=Nkx3-2 PE=1 SV=2
P47708	P47708	CRC-D09F8D8D2CBB271E	query	sp|P47708|RP3A_MOUSE Rabphilin-3A OS=Mus musculus OX=10090 GN=Rph3a PE=1 SV=2
P21274	P21274	CRC-D0C03B63B1D5C4E2	query	sp|P21274|BMP2_MOUSE Bone morphogenetic protein 2 OS=Mus musculus OX=10090 GN=Bmp2 PE=1 SV=3
Q08999	Q08999	CRC-D129032FB1F383D4	query	sp|Q08999|RBL2_HUMAN Retinoblastoma-like protein 2 OS=Homo sapiens OX=9606 GN=RBL2 PE=1 SV=3
P59190	P59190	CRC-D16A0C71797ED782	query	sp|P59190|RAB15_HUMAN Ras-related protein Rab-15 OS=Homo sapiens OX=9606 GN=RAB15 PE=1 SV=1
Q63210	Q63210	CRC-D178524AD7A0A9FF	query	sp|Q63210|GNA12_RAT Guanine nucleotide-binding protein subunit alpha-12 OS=Rattus norvegicus OX=10116 GN=Gna12 PE=1 SV=3
Q9QXX8	Q9QXX8	CRC-D17E4B099F4EA579	query	sp|Q9QXX8|NUFP1_MOUSE FMR1-interacting protein NUFIP1 OS=Mus musculus OX=10090 GN=Nufip1 PE=1 SV=1
Q9UH92	Q9UH92	CRC-D1981730051473C5	query	sp|Q9UH92|MLX_HUMAN Max-like protein X OS=Homo sapiens OX=9606 GN=MLX PE=1 SV=2
Q13643	Q13643	CRC-D1A037C260370DFD	query	sp|Q13643|FHL3_HUMAN Four and a half LIM domains protein 3 OS=Homo sapiens OX=9606 GN=FHL3 PE=1 SV=4
P35293	P35293	CRC-D1B0F48666999B77	query	sp|P35293|RAB18_MOUSE Ras-related protein Rab-18 OS=Mus musculus OX=10090 GN=Rab18 PE=1 SV=2
P43403	P43403	CRC-D1E1A8EC66FA116F	query	sp|P43403|ZAP70_HUMAN Tyrosine-protein kinase ZAP-70 OS=Homo sapiens OX=9606 GN=ZAP70 PE=1 SV=1
B9EKI3	B9EKI3	CRC-D208A815FF740CF1	query	sp|B9EKI3|TMF1_MOUSE TATA element modulatory factor OS=Mus musculus OX=10090 GN=Tmf1 PE=1 SV=2
P10398	P10398	CRC-D23E5711304AA468	query	sp|P10398|ARAF_HUMAN Serine/threonine-protein kinase A-Raf OS=Homo sapiens OX=9606 GN=ARAF PE=1 SV=2
Q92786	Q92786	CRC-D243CEB421B313CA	query	sp|Q92786|PROX1_HUMAN Prospero homeobox protein 1 OS=Homo sapiens OX=9606 GN=PROX1 PE=1 SV=2
P07911	P07911	CRC-D26A07A76353AE48	query	sp|P07911|UROM_HUMAN Uromodulin OS=Homo sapiens OX=9606 GN=UMOD PE=1 SV=1
P24588	P24588	CRC-D2A86298EAF1BE32	query	sp|P24588|AKAP5_HUMAN A-kinase anchor protein 5 OS=Homo sapiens OX=9606 GN=AKAP5 PE=1 SV=3
Q07813	Q07813	CRC-D2E0B3566579FAFF	query	sp|Q07813|BAX_MOUSE Apoptosis regulator BAX OS=Mus musculus OX=10090 GN=Bax PE=1 SV=1
Q6PJ80	Q6PJ80	CRC-D31E1049D4DB241B	query	tr|Q6PJ80|Q6PJ80_HUMAN UBX domain-containing protein 4 OS=Homo sapiens OX=9606 GN=UBXN4 PE=1 SV=1
Q60749	Q60749	CRC-D33DE960BEA9E5AA	query	sp|Q60749|KHDR1_MOUSE KH domain-containing, RNA-binding, signal transduction-associated protein 1 OS=Mus musculus OX=10090 GN=Khdrbs1 PE=1 SV=2
P51572	P51572	CRC-D34367F870D6EB00	query	sp|P51572|BAP31_HUMAN B-cell receptor-associated protein 31 OS=Homo sapiens OX=9606 GN=BCAP31 PE=1 SV=3
P49763	P49763	CRC-D364C6A73C1C6987	query	sp|P49763|PLGF_HUMAN Placenta growth factor OS=Homo sapiens OX=9606 GN=PGF PE=1 SV=2
Q5T3J3	Q5T3J3	CRC-D39A2BB494F16AAA	query	sp|Q5T3J3|LRIF1_HUMAN Ligand-dependent nuclear receptor-interacting factor 1 OS=Homo sapiens OX=9606 GN=LRIF1 PE=1 SV=1
Q5UEC5	Q5UEC5	CRC-D3B09DF5396B95F3	query	tr|Q5UEC5|Q5UEC5_DROME TAF4 OS=Drosophila melanogaster OX=7227 GN=nht PE=2 SV=1
P68400	P68400	CRC-D3B6F5D13FF7422D	query	sp|P68400|CSK21_HUMAN Casein kinase II subunit alpha OS=Homo sapiens OX=9606 GN=CSNK2A1 PE=1 SV=1
Q9Y2Q3	Q9Y2Q3	CRC-D3FDAFD1533B58A4	query	sp|Q9Y2Q3|GSTK1_HUMAN Glutathione S-transferase kappa 1 OS=Homo sapiens OX=9606 GN=GSTK1 PE=1 SV=3
O00628	O00628	CRC-D405387F7F14B432	query	sp|O00628|PEX7_HUMAN Peroxisomal targeting signal 2 receptor OS=Homo sapiens OX=9606 GN=PEX7 PE=1 SV=1
P08957	P08957	CRC-D41C02203747C965	query	sp|P08957|T1MK_ECOLI Type I restriction enzyme EcoKI methylase subunit OS=Escherichia coli (strain K12) OX=83333 GN=hsdM PE=1 SV=1
Q05793	Q05793	CRC-D41D2A2EBA65C80B	query	sp|Q05793|PGBM_MOUSE Basement membrane-specific heparan sulfate proteoglycan core protein OS=Mus musculus OX=10090 GN=Hspg2 PE=1 SV=1
P06750	P06750	CRC-D455F2A72F609759	query	sp|P06750|AGGL_RICCO Agglutinin OS=Ricinus communis OX=3988 PE=1 SV=1
P63104	P63104	CRC-D464DF2286BBFE60	query	sp|P63104|1433Z_HUMAN 14-3-3 protein zeta/delta OS=Homo sapiens OX=9606 GN=YWHAZ PE=1 SV=1
P16104	P16104	CRC-D4683775C2E6C3A9	query	sp|P16104|H2AX_HUMAN Histone H2AX OS=Homo sapiens OX=9606 GN=H2AX PE=1 SV=2
Q8CJ26	Q8CJ26	CRC-D46B7402D8362FDF	query	sp|Q8CJ26|NRADD_MOUSE Death domain-containing membrane protein NRADD OS=Mus musculus OX=10090 GN=Nradd PE=1 SV=1
P10636	P10636	CRC-D46C66CDBCD196E8	query	sp|P10636|TAU_HUMAN Microtubule-associated protein tau OS=Homo sapiens OX=9606 GN=MAPT PE=1 SV=5
Q9UJU2	Q9UJU2	CRC-D480D440698EEFE3	query	sp|Q9UJU2|LEF1_HUMAN Lymphoid enhancer-binding factor 1 OS=Homo sapiens OX=9606 GN=LEF1 PE=1 SV=1
P60042	P60042	CRC-D48B5454C4490375	query	sp|P60042|SMS_RAT Somatostatin OS=Rattus norvegicus OX=10116 GN=Sst PE=1 SV=1
P32481	P32481	CRC-D498AE62BC3E81CD	query	sp|P32481|IF2G_YEAST Eukaryotic translation initiation factor 2 subunit gamma OS=Saccharomyces cerevisiae (strain ATCC 204508 / S288c) OX=559292 GN=GCD11 PE=1 SV=1
Q66H76	Q66H76	CRC-D4B9477CC0B7BB7E	query	sp|Q66H76|PAXI_RAT Paxillin OS=Rattus norvegicus OX=10116 GN=Pxn PE=1 SV=1
P17480	P17480	CRC-D4F0F8BB180E757D	query	sp|P17480|UBF1_HUMAN Nucleolar transcription factor 1 OS=Homo sapiens OX=9606 GN=UBTF PE=1 SV=1
P29590	P29590	CRC-D50968A977E34287	query	sp|P29590|PML_HUMAN Protein PML OS=Homo sapiens OX=9606 GN=PML PE=1 SV=3
O60885	O60885	CRC-D52EFE1CF9960907	query	sp|O60885|BRD4_HUMAN Bromodomain-containing protein 4 OS=Homo sapiens OX=9606 GN=BRD4 PE=1 SV=2
P78364	P78364	CRC-D53764F80931A938	query	sp|P78364|PHC1_HUMAN Polyhomeotic-like protein 1 OS=Homo sapiens OX=9606 GN=PHC1 PE=1 SV=3
Q6Y5D8	Q6Y5D8	CRC-D55F2E694A153D90	query	sp|Q6Y5D8|RHG10_MOUSE Rho GTPase-activating protein 10 OS=Mus musculus OX=10090 GN=Arhgap10 PE=1 SV=2
P30533	P30533	CRC-D56A7DA754125CFA	query	sp|P30533|AMRP_HUMAN Alpha-2-macroglobulin receptor-associated protein OS=Homo sapiens OX=9606 GN=LRPAP1 PE=1 SV=1
P46934	P46934	CRC-D56EBBC50A34F13B	query	sp|P46934|NEDD4_HUMAN E3 ubiquitin-protein ligase NEDD4 OS=Homo sapiens OX=9606 GN=NEDD4 PE=1 SV=4
P16092	P16092	CRC-D5A4695FA680926B	query	sp|P16092|FGFR1_MOUSE Fibroblast growth factor receptor 1 OS=Mus musculus OX=10090 GN=Fgfr1 PE=1 SV=2
P04275	P04275	CRC-D5C1C78360917C29	query	sp|P04275|VWF_HUMAN von Willebrand factor OS=Homo sapiens OX=9606 GN=VWF PE=1 SV=4
O60716	O60716	CRC-D5C37489A891F292	query	sp|O60716|CTND1_HUMAN Catenin delta-1 OS=Homo sapiens OX=9606 GN=CTNND1 PE=1 SV=1
P62826	P62826	CRC-D5C9B7275C34BCE0	query	sp|P62826|RAN_HUMAN GTP-binding nuclear protein Ran OS=Homo sapiens OX=9606 GN=RAN PE=1 SV=3
P03244	P03244	CRC-D6665B27183720CC	query	sp|P03244|E1B55_ADE02 E1B 55 kDa protein OS=Human adenovirus C serotype 2 OX=10515 GN=E1B PE=1 SV=2
P97454	P97454	CRC-D66B638DA76BC20B	query	sp|P97454|SMAD5_MOUSE Mothers against decapentaplegic homolog 5 OS=Mus musculus OX=10090 GN=Smad5 PE=1 SV=2
P01135	P01135	CRC-D692184F9353DE47	query	sp|P01135|TGFA_HUMAN Protransforming growth factor alpha OS=Homo sapiens OX=9606 GN=TGFA PE=1 SV=1
Q01593	Q01593	CRC-D6A0F740D733060F	query	sp|Q01593|ABI3_ARATH B3 domain-containing transcription factor ABI3 OS=Arabidopsis thaliana OX=3702 GN=ABI3 PE=1 SV=1
P15337	P15337	CRC-D6D715DEED679FF2	query	sp|P15337|CREB1_RAT Cyclic AMP-responsive element-binding protein 1 OS=Rattus norvegicus OX=10116 GN=Creb1 PE=1 SV=2
Q9FK13	Q9FK13	CRC-D6EA6676B3DB9CFE	query	sp|Q9FK13|PDV1_ARATH Plastid division protein PDV1 OS=Arabidopsis thaliana OX=3702 GN=PDV1 PE=1 SV=1
Q02248	Q02248	CRC-D708F170A3FBED6E	query	sp|Q02248|CTNB1_MOUSE Catenin beta-1 OS=Mus musculus OX=10090 GN=Ctnnb1 PE=1 SV=1
Q99104	Q99104	CRC-D729DF9222EBCAA0	query	sp|Q99104|MYO5A_MOUSE Unconventional myosin-Va OS=Mus musculus OX=10090 GN=Myo5a PE=1 SV=2
O96020	O96020	CRC-D7DC9BEEF3FD62EC	query	sp|O96020|CCNE2_HUMAN G1/S-specific cyclin-E2 OS=Homo sapiens OX=9606 GN=CCNE2 PE=1 SV=1
Q9ESN9	Q9ESN9	CRC-D7DEE54C17B74106	query	sp|Q9ESN9|JIP3_MOUSE C-Jun-amino-terminal kinase-interacting protein 3 OS=Mus musculus OX=10090 GN=Mapk8ip3 PE=1 SV=1
P09731	P09731	CRC-D7F033C8009502BC	query	sp|P09731|US07_HCMVA Unique short US7 glycoprotein OS=Human cytomegalovirus (strain AD169) OX=10360 GN=US7 PE=3 SV=1
Q15080	Q15080	CRC-D82FE9E5BA12890B	query	sp|Q15080|NCF4_HUMAN Neutrophil cytosol factor 4 OS=Homo sapiens OX=9606 GN=NCF4 PE=1 SV=2
O60907	O60907	CRC-D830A37781E2A15C	query	sp|O60907|TBL1X_HUMAN F-box-like/WD repeat-containing protein TBL1X OS=Homo sapiens OX=9606 GN=TBL1X PE=1 SV=3
Q07820-1	Q07820	CRC-D85821AC59275F1F	query	sp|Q07820|MCL1_HUMAN Induced myeloid leukemia cell differentiation protein Mcl-1 OS=Homo sapiens OX=9606 GN=MCL1 PE=1 SV=3
Q07820	Q07820	CRC-D85821AC59275F1F	query	sp|Q07820|MCL1_HUMAN Induced myeloid leukemia cell differentiation protein Mcl-1 OS=Homo sapiens OX=9606 GN=MCL1 PE=1 SV=3
Q07820-2	Q07820	CRC-D85821AC59275F1F	query	sp|Q07820|MCL1_HUMAN Induced myeloid leukemia cell differentiation protein Mcl-1 OS=Homo sapiens OX=9606 GN=MCL1 PE=1 SV=3
P17141	P17141	CRC-D873AEEB2547F809	query	sp|P17141|ZFP37_MOUSE Zinc finger protein 37 OS=Mus musculus OX=10090 GN=Zfp37 PE=2 SV=4
P45481	P45481	CRC-D89AF52B7BD33347	query	sp|P45481|CBP_MOUSE Histone lysine acetyltransferase CREBBP OS=Mus musculus OX=10090 GN=Crebbp PE=1 SV=3
