From	To	crc_hash	source	description
P04234	P04234	CRC-6C1F248150186D21	query	sp|P04234|CD3D_HUMAN T-cell surface glycoprotein CD3 delta chain OS=Homo sapiens OX=9606 GN=CD3D PE=1 SV=1
P02751	P02751	CRC-6C436A7A5FEE6DEB	query	sp|P02751|FINC_HUMAN Fibronectin OS=Homo sapiens OX=9606 GN=FN1 PE=1 SV=5
Q9J2K2	Q9J2K2	CRC-6C8D30F7C38FF77F	query	tr|Q9J2K2|Q9J2K2_9GAMA ORF45 OS=Rhesus monkey rhadinovirus H26-95 OX=69256 GN=ORF45 PE=4 SV=1
Q6ZVM7	Q6ZVM7	CRC-6CB4B4433076D8D0	query	sp|Q6ZVM7|TM1L2_HUMAN TOM1-like protein 2 OS=Homo sapiens OX=9606 GN=TOM1L2 PE=1 SV=1
Q9ERP3	Q9ERP3	CRC-6CD3429162D5BEFA	query	sp|Q9ERP3|TRI54_MOUSE Tripartite motif-containing protein 54 OS=Mus musculus OX=10090 GN=Trim54 PE=1 SV=1
Q9QWV9	Q9QWV9	CRC-6D090F5CA7C3A79C	query	sp|Q9QWV9|CCNT1_MOUSE Cyclin-T1 OS=Mus musculus OX=10090 GN=Ccnt1 PE=1 SV=3
Q26807	Q26807	CRC-6D57A22427F3EF91	query	tr|Q26807|Q26807_9TRYP VSG-like protein OS=Trypanosoma brucei OX=5691 GN=sra PE=2 SV=2
O70433	O70433	CRC-6D8CBC4B4424BFF2	query	sp|O70433|FHL2_MOUSE Four and a half LIM domains protein 2 OS=Mus musculus OX=10090 GN=Fhl2 PE=1 SV=1
P0AEN4	P0AEN4	CRC-6DD5DF7B2ECB7090	query	sp|P0AEN4|FTSL_ECOLI Cell division protein FtsL OS=Escherichia coli (strain K12) OX=83333 GN=ftsL PE=1 SV=1
Q14526	Q14526	CRC-6DDD0F49C4E490D3	query	sp|Q14526|HIC1_HUMAN Hypermethylated in cancer 1 protein OS=Homo sapiens OX=9606 GN=HIC1 PE=1 SV=5
Q12778	Q12778	CRC-6DEF6C994BDFDBAB	query	sp|Q12778|FOXO1_HUMAN Forkhead box protein O1 OS=Homo sapiens OX=9606 GN=FOXO1 PE=1 SV=2
Q9H840	Q9H840	CRC-6E118922AFDCF567	query	sp|Q9H840|GEMI7_HUMAN Gem-associated protein 7 OS=Homo sapiens OX=9606 GN=GEMIN7 PE=1 SV=1
P14151	P14151	CRC-6EA9918ECA2D3643	query	sp|P14151|LYAM1_HUMAN L-selectin OS=Homo sapiens OX=9606 GN=SELL PE=1 SV=2
P31749	P31749	CRC-6EAFF4F8AD436714	query	sp|P31749|AKT1_HUMAN RAC-alpha serine/threonine-protein kinase OS=Homo sapiens OX=9606 GN=AKT1 PE=1 SV=2
Q15404	Q15404	CRC-6EDB2E033F417468	query	sp|Q15404|RSU1_HUMAN Ras suppressor protein 1 OS=Homo sapiens OX=9606 GN=RSU1 PE=1 SV=3
P60842	P60842	CRC-6EF89939F3045420	query	sp|P60842|IF4A1_HUMAN Eukaryotic initiation factor 4A-I OS=Homo sapiens OX=9606 GN=EIF4A1 PE=1 SV=1
Q38898	Q38898	CRC-6F138F9149ED3CD7	query	sp|Q38898|AKT2_ARATH Potassium channel AKT2/3 OS=Arabidopsis thaliana OX=3702 GN=AKT2 PE=1 SV=1
Q9UBN7	Q9UBN7	CRC-6F17731268A33114	query	sp|Q9UBN7|HDAC6_HUMAN Histone deacetylase 6 OS=Homo sapiens OX=9606 GN=HDAC6 PE=1 SV=2
P50148	P50148	CRC-6F69C4F617DFA7C7	query	sp|P50148|GNAQ_HUMAN Guanine nucleotide-binding protein G(q) subunit alpha OS=Homo sapiens OX=9606 GN=GNAQ PE=1 SV=4
P16410	P16410	CRC-6F9466FB2E139A5A	query	sp|P16410|CTLA4_HUMAN Cytotoxic T-lymphocyte protein 4 OS=Homo sapiens OX=9606 GN=CTLA4 PE=1 SV=3
P14373	P14373	CRC-6F963D9048D8A731	query	sp|P14373|TRI27_HUMAN Zinc finger protein RFP OS=Homo sapiens OX=9606 GN=TRIM27 PE=1 SV=1
P04578	P04578	CRC-6FAB16AF85107FE0	query	sp|P04578|ENV_HV1H2 Envelope glycoprotein gp160 OS=Human immunodeficiency virus type 1 group M subtype B (isolate HXB2) OX=11706 GN=env PE=1 SV=2
Q93096	Q93096	CRC-702008013D3F3835	query	sp|Q93096|TP4A1_HUMAN Protein tyrosine phosphatase type IVA 1 OS=Homo sapiens OX=9606 GN=PTP4A1 PE=1 SV=2
P06213	P06213	CRC-709A955660739066	query	sp|P06213|INSR_HUMAN Insulin receptor OS=Homo sapiens OX=9606 GN=INSR PE=1 SV=4
Q9Y618	Q9Y618	CRC-70A89C9A19612AAD	query	sp|Q9Y618|NCOR2_HUMAN Nuclear receptor corepressor 2 OS=Homo sapiens OX=9606 GN=NCOR2 PE=1 SV=3
Q9NR28	Q9NR28	CRC-70C2AE0DC654D031	query	sp|Q9NR28|DBLOH_HUMAN Diablo IAP-binding mitochondrial protein OS=Homo sapiens OX=9606 GN=DIABLO PE=1 SV=1
O34580	O34580	CRC-70C553EFC88E6D6D	query	sp|O34580|PCRA_BACSU ATP-dependent DNA helicase PcrA OS=Bacillus subtilis (strain 168) OX=224308 GN=pcrA PE=1 SV=1
Q9NY72	Q9NY72	CRC-70F6C604E9E26662	query	sp|Q9NY72|SCN3B_HUMAN Sodium channel subunit beta-3 OS=Homo sapiens OX=9606 GN=SCN3B PE=1 SV=1
P62630	P62630	CRC-71072871DE7405DC	query	sp|P62630|EF1A1_RAT Elongation factor 1-alpha 1 OS=Rattus norvegicus OX=10116 GN=Eef1a1 PE=2 SV=1
O88565	M0RC99	CRC-716AB5CC4ECAFD77	query	sp|M0RC99|RAB5A_RAT Ras-related protein Rab-5A OS=Rattus norvegicus OX=10116 GN=Rab5a PE=2 SV=1
P26951	P26951	CRC-716CE1803F2E5FC0	query	sp|P26951|IL3RA_HUMAN Interleukin-3 receptor subunit alpha OS=Homo sapiens OX=9606 GN=IL3RA PE=1 SV=1
Q92698	Q92698	CRC-718100974CA6687B	query	sp|Q92698|RAD54_HUMAN DNA repair and recombination protein RAD54-like OS=Homo sapiens OX=9606 GN=RAD54L PE=1 SV=2
Q10282	Q10282	CRC-7186EB505C68980E	query	sp|Q10282|GBB_SCHPO Guanine nucleotide-binding protein subunit beta OS=Schizosaccharomyces pombe (strain 972 / ATCC 24843) OX=284812 GN=git5 PE=3 SV=2
Q92844	Q92844	CRC-718D30CF03EB27FF	query	sp|Q92844|TANK_HUMAN TRAF family member-associated NF-kappa-B activator OS=Homo sapiens OX=9606 GN=TANK PE=1 SV=2
Q9UBP5	Q9UBP5	CRC-71B7B1AA69BA88D2	query	sp|Q9UBP5|HEY2_HUMAN Hairy/enhancer-of-split related with YRPW motif protein 2 OS=Homo sapiens OX=9606 GN=HEY2 PE=1 SV=1
O04663	O04663	CRC-71FEB309E073A9D2	query	sp|O04663|IF4E4_ARATH Eukaryotic translation initiation factor isoform 4E OS=Arabidopsis thaliana OX=3702 GN=EIF(ISO)4E PE=1 SV=2
Q13247	Q13247	CRC-72305506CE948B94	query	sp|Q13247|SRSF6_HUMAN Serine/arginine-rich splicing factor 6 OS=Homo sapiens OX=9606 GN=SRSF6 PE=1 SV=2
Q12942	Q06547	CRC-723D63962FB29BD9	query	sp|Q06547|GABP1_HUMAN GA-binding protein subunit beta-1 OS=Homo sapiens OX=9606 GN=GABPB1 PE=1 SV=2
Q06547	Q06547	CRC-723D63962FB29BD9	query	sp|Q06547|GABP1_HUMAN GA-binding protein subunit beta-1 OS=Homo sapiens OX=9606 GN=GABPB1 PE=1 SV=2
P29476-3	P29476	CRC-7255C5AE165200F5	query	sp|P29476|NOS1_RAT Nitric oxide synthase, brain OS=Rattus norvegicus OX=10116 GN=Nos1 PE=1 SV=1
Q8WYQ5	Q8WYQ5	CRC-72D962BBE32890EC	query	sp|Q8WYQ5|DGCR8_HUMAN Microprocessor complex subunit DGCR8 OS=Homo sapiens OX=9606 GN=DGCR8 PE=1 SV=1
Q92831	Q92831	CRC-72F516E8BC00CC0C	query	sp|Q92831|KAT2B_HUMAN Histone acetyltransferase KAT2B OS=Homo sapiens OX=9606 GN=KAT2B PE=1 SV=3
P32298-3	P32298	CRC-72FCF94ED551F2D0	query	sp|P32298|GRK4_HUMAN G protein-coupled receptor kinase 4 OS=Homo sapiens OX=9606 GN=GRK4 PE=1 SV=3
P32298-2	P32298	CRC-72FCF94ED551F2D0	query	sp|P32298|GRK4_HUMAN G protein-coupled receptor kinase 4 OS=Homo sapiens OX=9606 GN=GRK4 PE=1 SV=3
P32298-4	P32298	CRC-72FCF94ED551F2D0	query	sp|P32298|GRK4_HUMAN G protein-coupled receptor kinase 4 OS=Homo sapiens OX=9606 GN=GRK4 PE=1 SV=3
Q9WTV5	Q9WTV5	CRC-731BC90C3226B88B	query	sp|Q9WTV5|PSMD9_RAT 26S proteasome non-ATPase regulatory subunit 9 OS=Rattus norvegicus OX=10116 GN=Psmd9 PE=1 SV=1
Q14686	Q14686	CRC-73219502F5138427	query	sp|Q14686|NCOA6_HUMAN Nuclear receptor coactivator 6 OS=Homo sapiens OX=9606 GN=NCOA6 PE=1 SV=3
P20700	P20700	CRC-73292877745722C4	query	sp|P20700|LMNB1_HUMAN Lamin-B1 OS=Homo sapiens OX=9606 GN=LMNB1 PE=1 SV=2
Q8K094	Q8K094	CRC-732FC30A94105187	query	tr|Q8K094|Q8K094_MOUSE Poliovirus receptor OS=Mus musculus OX=10090 GN=Pvr PE=1 SV=1
O89100	O89100	CRC-736311D0640CD3D0	query	sp|O89100|GRAP2_MOUSE GRB2-related adaptor protein 2 OS=Mus musculus OX=10090 GN=Grap2 PE=1 SV=1
P0AFS3	P0AFS3	CRC-73B942EE144E2CC3	query	sp|P0AFS3|FOLM_ECOLI Dihydromonapterin reductase OS=Escherichia coli (strain K12) OX=83333 GN=folM PE=1 SV=1
Q9UK45	Q9UK45	CRC-7429DC0FB365C9C8	query	sp|Q9UK45|LSM7_HUMAN U6 snRNA-associated Sm-like protein LSm7 OS=Homo sapiens OX=9606 GN=LSM7 PE=1 SV=1
O75791	O75791	CRC-74F4C8D0EBB56D55	query	sp|O75791|GRAP2_HUMAN GRB2-related adapter protein 2 OS=Homo sapiens OX=9606 GN=GRAP2 PE=1 SV=1
Q61410	Q61410	CRC-74F9D9A6835711A5	query	sp|Q61410|KGP2_MOUSE cGMP-dependent protein kinase 2 OS=Mus musculus OX=10090 GN=Prkg2 PE=1 SV=1
P01137	P01137	CRC-75391614250288FE	query	sp|P01137|TGFB1_HUMAN Transforming growth factor beta-1 proprotein OS=Homo sapiens OX=9606 GN=TGFB1 PE=1 SV=2
P01237	P01237	CRC-755E2874A26862C7	query	sp|P01237|PRL_RAT Prolactin OS=Rattus norvegicus OX=10116 GN=Prl PE=1 SV=1
P48415	P48415	CRC-757B7A7231BEE6F0	query	sp|P48415|SEC16_YEAST COPII coat assembly protein SEC16 OS=Saccharomyces cerevisiae (strain ATCC 204508 / S288c) OX=559292 GN=SEC16 PE=1 SV=2
P04141	P04141	CRC-75D1E50506BCA7A8	query	sp|P04141|CSF2_HUMAN Granulocyte-macrophage colony-stimulating factor OS=Homo sapiens OX=9606 GN=CSF2 PE=1 SV=1
P15172	P15172	CRC-75E624D2ED5B0B33	query	sp|P15172|MYOD1_HUMAN Myoblast determination protein 1 OS=Homo sapiens OX=9606 GN=MYOD1 PE=1 SV=3
P60484	P60484	CRC-75F97C3DD6802BA9	query	sp|P60484|PTEN_HUMAN Phosphatidylinositol 3,4,5-trisphosphate 3-phosphatase and dual-specificity protein phosphatase PTEN OS=Homo sapiens OX=9606 GN=PTEN PE=1 SV=1
P00451	P00451	CRC-75FB6A2955C74CB0	query	sp|P00451|FA8_HUMAN Coagulation factor VIII OS=Homo sapiens OX=9606 GN=F8 PE=1 SV=1
Q7L311	Q7L311	CRC-7627CBFFE61C329B	query	sp|Q7L311|ARMX2_HUMAN Armadillo repeat-containing X-linked protein 2 OS=Homo sapiens OX=9606 GN=ARMCX2 PE=2 SV=1
Q15418	Q15418	CRC-765731A4442A53DF	query	sp|Q15418|KS6A1_HUMAN Ribosomal protein S6 kinase alpha-1 OS=Homo sapiens OX=9606 GN=RPS6KA1 PE=1 SV=2
O14788	O14788	CRC-766176446348097F	query	sp|O14788|TNF11_HUMAN Tumor necrosis factor ligand superfamily member 11 OS=Homo sapiens OX=9606 GN=TNFSF11 PE=1 SV=1
H2LD76	H2LD76	CRC-76A462F1FA47D8F6	query	tr|H2LD76|H2LD76_ORYLA Ribosome biogenesis protein WDR12 OS=Oryzias latipes OX=8090 GN=wdr12 PE=3 SV=2
Q08879	Q08879	CRC-76C527A12E97D0E1	query	sp|Q08879|FBLN1_MOUSE Fibulin-1 OS=Mus musculus OX=10090 GN=Fbln1 PE=1 SV=2
O88618	O88618	CRC-76D806CE23478D92	query	sp|O88618|FTCD_RAT Formimidoyltransferase-cyclodeaminase OS=Rattus norvegicus OX=10116 GN=Ftcd PE=1 SV=4
Q86T24	Q86T24	CRC-76D94B4051056DB5	query	sp|Q86T24|KAISO_HUMAN Transcriptional regulator Kaiso OS=Homo sapiens OX=9606 GN=ZBTB33 PE=1 SV=2
P62491	P62491	CRC-76FC1E113A29B269	query	sp|P62491|RB11A_HUMAN Ras-related protein Rab-11A OS=Homo sapiens OX=9606 GN=RAB11A PE=1 SV=3
P62492	P62492	CRC-76FC1E113A29B269	query	sp|P62492|RB11A_MOUSE Ras-related protein Rab-11A OS=Mus musculus OX=10090 GN=Rab11a PE=1 SV=3
Q8BGS1	Q8BGS1	CRC-77348A1F68EF596A	query	sp|Q8BGS1|E41L5_MOUSE Band 4.1-like protein 5 OS=Mus musculus OX=10090 GN=Epb41l5 PE=1 SV=1
Q8R0L9	Q8R0L9	CRC-773C73A40B26190A	query	sp|Q8R0L9|TADA3_MOUSE Transcriptional adapter 3 OS=Mus musculus OX=10090 GN=Tada3 PE=1 SV=1
Q92769	Q92769	CRC-775419CCCDAE07FA	query	sp|Q92769|HDAC2_HUMAN Histone deacetylase 2 OS=Homo sapiens OX=9606 GN=HDAC2 PE=1 SV=2
P15331	P15331	CRC-777300B08A312953	query	sp|P15331|PERI_MOUSE Peripherin OS=Mus musculus OX=10090 GN=Prph PE=1 SV=2
Q99576	Q99576	CRC-77B1024969FA8687	query	sp|Q99576|T22D3_HUMAN TSC22 domain family protein 3 OS=Homo sapiens OX=9606 GN=TSC22D3 PE=1 SV=2
Q96TL7	Q96TL7	CRC-77C5070697D1A9CF	query	sp|Q96TL7|RAP1_SCHPO DNA-binding protein rap1 OS=Schizosaccharomyces pombe (strain 972 / ATCC 24843) OX=284812 GN=rap1 PE=1 SV=1
Q15544	Q15544	CRC-77C7BDC667D19A8F	query	sp|Q15544|TAF11_HUMAN Transcription initiation factor TFIID subunit 11 OS=Homo sapiens OX=9606 GN=TAF11 PE=1 SV=1
D3ZUY8	D3ZUY8	CRC-77D1C8AC17B00EA4	query	tr|D3ZUY8|D3ZUY8_RAT AP-2 complex subunit alpha OS=Rattus norvegicus OX=10116 GN=Ap2a1 PE=1 SV=2
P25054	P25054	CRC-77E194AE4A91DC5A	query	sp|P25054|APC_HUMAN Adenomatous polyposis coli protein OS=Homo sapiens OX=9606 GN=APC PE=1 SV=2
Q9UBN4	Q9UBN4	CRC-77E4D27C374D660E	query	sp|Q9UBN4|TRPC4_HUMAN Short transient receptor potential channel 4 OS=Homo sapiens OX=9606 GN=TRPC4 PE=1 SV=1
Q9UKL0	Q9UKL0	CRC-77E90FB0EFD514B2	query	sp|Q9UKL0|RCOR1_HUMAN REST corepressor 1 OS=Homo sapiens OX=9606 GN=RCOR1 PE=1 SV=2
P67930	P67930	CRC-77EC37A102584429	query	sp|P67930|SOMA_SHEEP Somatotropin OS=Ovis aries OX=9940 GN=GH1 PE=1 SV=1
Q9DBM0	Q9DBM0	CRC-78012611A5DF2589	query	sp|Q9DBM0|ABCG8_MOUSE ATP-binding cassette sub-family G member 8 OS=Mus musculus OX=10090 GN=Abcg8 PE=1 SV=1
P24230	P24230	CRC-7826143A8F4292A2	query	sp|P24230|RECG_ECOLI ATP-dependent DNA helicase RecG OS=Escherichia coli (strain K12) OX=83333 GN=recG PE=1 SV=1
P00813	P00813	CRC-786BC5085CA9AFCB	query	sp|P00813|ADA_HUMAN Adenosine deaminase OS=Homo sapiens OX=9606 GN=ADA PE=1 SV=3
P25815	P25815	CRC-786E6E3F3EACC6C1	query	sp|P25815|S100P_HUMAN Protein S100-P OS=Homo sapiens OX=9606 GN=S100P PE=1 SV=2
Q60770	Q60770	CRC-7874B71DE107871A	query	sp|Q60770|STXB3_MOUSE Syntaxin-binding protein 3 OS=Mus musculus OX=10090 GN=Stxbp3 PE=1 SV=1
P26039	P26039	CRC-78832388E2392B8E	query	sp|P26039|TLN1_MOUSE Talin-1 OS=Mus musculus OX=10090 GN=Tln1 PE=1 SV=2
Q99733	Q99733	CRC-788E1F9F5BC8FD45	query	sp|Q99733|NP1L4_HUMAN Nucleosome assembly protein 1-like 4 OS=Homo sapiens OX=9606 GN=NAP1L4 PE=1 SV=1
Q9BYX4	Q9BYX4	CRC-789CFB4824B92DC9	query	sp|Q9BYX4|IFIH1_HUMAN Interferon-induced helicase C domain-containing protein 1 OS=Homo sapiens OX=9606 GN=IFIH1 PE=1 SV=3
P13595	P13595	CRC-78AF831BABD23918	query	sp|P13595|NCAM1_MOUSE Neural cell adhesion molecule 1 OS=Mus musculus OX=10090 GN=Ncam1 PE=1 SV=3
P47224	P47224	CRC-78E98395FAE10257	query	sp|P47224|MSS4_HUMAN Guanine nucleotide exchange factor MSS4 OS=Homo sapiens OX=9606 GN=RABIF PE=1 SV=2
P08107	P0DMV8	CRC-78F513118C96DE66	query	sp|P0DMV8|HS71A_HUMAN Heat shock 70 kDa protein 1A OS=Homo sapiens OX=9606 GN=HSPA1A PE=1 SV=1
P08107	P0DMV9	CRC-78F513118C96DE66	query	sp|P0DMV9|HS71B_HUMAN Heat shock 70 kDa protein 1B OS=Homo sapiens OX=9606 GN=HSPA1B PE=1 SV=1
Q61502	Q61502	CRC-7922ACE79C73944B	query	sp|Q61502|E2F5_MOUSE Transcription factor E2F5 OS=Mus musculus OX=10090 GN=E2f5 PE=1 SV=2
P78352	P78352	CRC-7922D3F220F9A101	query	sp|P78352|DLG4_HUMAN Disks large homolog 4 OS=Homo sapiens OX=9606 GN=DLG4 PE=1 SV=3
P31016	P31016	CRC-7922D4E8E0F9AD85	query	sp|P31016|DLG4_RAT Disks large homolog 4 OS=Rattus norvegicus OX=10116 GN=Dlg4 PE=1 SV=1
P0ABG4	P0ABG4	CRC-7935EC952AD9A1F3	query	sp|P0ABG4|FTSW_ECOLI Probable peptidoglycan glycosyltransferase FtsW OS=Escherichia coli (strain K12) OX=83333 GN=ftsW PE=1 SV=1
O45379	O45379	CRC-796818879C2F3004	query	sp|O45379|ARL3_CAEEL ADP-ribosylation factor-like protein 3 OS=Caenorhabditis elegans OX=6239 GN=arl-3 PE=1 SV=1
Q03142	Q03142	CRC-799E17845CD4021E	query	sp|Q03142|FGFR4_MOUSE Fibroblast growth factor receptor 4 OS=Mus musculus OX=10090 GN=Fgfr4 PE=1 SV=3
Q9NPD3	Q9NPD3	CRC-7A24E97897DAF313	query	sp|Q9NPD3|EXOS4_HUMAN Exosome complex component RRP41 OS=Homo sapiens OX=9606 GN=EXOSC4 PE=1 SV=3
Q9UPN9	Q9UPN9	CRC-7A36013799E9933C	query	sp|Q9UPN9|TRI33_HUMAN E3 ubiquitin-protein ligase TRIM33 OS=Homo sapiens OX=9606 GN=TRIM33 PE=1 SV=3
Q08499-4	Q08499	CRC-7A4773DD3A044F57	query	sp|Q08499|PDE4D_HUMAN cAMP-specific 3',5'-cyclic phosphodiesterase 4D OS=Homo sapiens OX=9606 GN=PDE4D PE=1 SV=2
Q08499-6	Q08499	CRC-7A4773DD3A044F57	query	sp|Q08499|PDE4D_HUMAN cAMP-specific 3',5'-cyclic phosphodiesterase 4D OS=Homo sapiens OX=9606 GN=PDE4D PE=1 SV=2
Q08499-7	Q08499	CRC-7A4773DD3A044F57	query	sp|Q08499|PDE4D_HUMAN cAMP-specific 3',5'-cyclic phosphodiesterase 4D OS=Homo sapiens OX=9606 GN=PDE4D PE=1 SV=2
Q08499-1	Q08499	CRC-7A4773DD3A044F57	query	sp|Q08499|PDE4D_HUMAN cAMP-specific 3',5'-cyclic phosphodiesterase 4D OS=Homo sapiens OX=9606 GN=PDE4D PE=1 SV=2
Q08499	Q08499	CRC-7A4773DD3A044F57	query	sp|Q08499|PDE4D_HUMAN cAMP-specific 3',5'-cyclic phosphodiesterase 4D OS=Homo sapiens OX=9606 GN=PDE4D PE=1 SV=2
Q08499-5	Q08499	CRC-7A4773DD3A044F57	query	sp|Q08499|PDE4D_HUMAN cAMP-specific 3',5'-cyclic phosphodiesterase 4D OS=Homo sapiens OX=9606 GN=PDE4D PE=1 SV=2
P70336	P70336	CRC-7A4F331165038161	query	sp|P70336|ROCK2_MOUSE Rho-associated protein kinase 2 OS=Mus musculus OX=10090 GN=Rock2 PE=1 SV=1
Q14790	Q14790	CRC-7A5FEAA6B39B582F	query	sp|Q14790|CASP8_HUMAN Caspase-8 OS=Homo sapiens OX=9606 GN=CASP8 PE=1 SV=1
P09803	P09803	CRC-7A6444148D3D5983	query	sp|P09803|CADH1_MOUSE Cadherin-1 OS=Mus musculus OX=10090 GN=Cdh1 PE=1 SV=1
Q91XD2	Q91XD2	CRC-7A93F9845BDAED91	query	sp|Q91XD2|LIMS2_MOUSE LIM and senescent cell antigen-like-containing domain protein 2 OS=Mus musculus OX=10090 GN=Lims2 PE=1 SV=1
P35221	P35221	CRC-7AAE6F5DDBAF5099	query	sp|P35221|CTNA1_HUMAN Catenin alpha-1 OS=Homo sapiens OX=9606 GN=CTNNA1 PE=1 SV=1
P16054	P16054	CRC-7AEBB8CC10C99F57	query	sp|P16054|KPCE_MOUSE Protein kinase C epsilon type OS=Mus musculus OX=10090 GN=Prkce PE=1 SV=1
O00482	O00482	CRC-7B07170C075490FE	query	sp|O00482|NR5A2_HUMAN Nuclear receptor subfamily 5 group A member 2 OS=Homo sapiens OX=9606 GN=NR5A2 PE=1 SV=2
Q8WWY3	Q8WWY3	CRC-7B50EC4C3393795C	query	sp|Q8WWY3|PRP31_HUMAN U4/U6 small nuclear ribonucleoprotein Prp31 OS=Homo sapiens OX=9606 GN=PRPF31 PE=1 SV=2
P50540	P50540	CRC-7B5D4ACAEF97C4F1	query	sp|P50540|MXI1_MOUSE Max-interacting protein 1 OS=Mus musculus OX=10090 GN=Mxi1 PE=1 SV=1
Q62227	Q62227	CRC-7B859325AA73DCA1	query	sp|Q62227|NR0B2_MOUSE Nuclear receptor subfamily 0 group B member 2 OS=Mus musculus OX=10090 GN=Nr0b2 PE=1 SV=1
P49815	P49815	CRC-7B915C46970D7D31	query	sp|P49815|TSC2_HUMAN Tuberin OS=Homo sapiens OX=9606 GN=TSC2 PE=1 SV=2
O00212	O00212	CRC-7B960AE8863C6DA5	query	sp|O00212|RHOD_HUMAN Rho-related GTP-binding protein RhoD OS=Homo sapiens OX=9606 GN=RHOD PE=1 SV=3
Q62120	Q62120	CRC-7BA35989B880D0A6	query	sp|Q62120|JAK2_MOUSE Tyrosine-protein kinase JAK2 OS=Mus musculus OX=10090 GN=Jak2 PE=1 SV=3
P62988	P62987	CRC-7BCB602ABEFAD02A	query	sp|P62987|RL40_HUMAN Ubiquitin-60S ribosomal protein L40 OS=Homo sapiens OX=9606 GN=UBA52 PE=1 SV=2
Q9Y6X2	Q9Y6X2	CRC-7C06EF599D48F87D	query	sp|Q9Y6X2|PIAS3_HUMAN E3 SUMO-protein ligase PIAS3 OS=Homo sapiens OX=9606 GN=PIAS3 PE=1 SV=2
Q9Y210	Q9Y210	CRC-7C955C2B0389AC47	query	sp|Q9Y210|TRPC6_HUMAN Short transient receptor potential channel 6 OS=Homo sapiens OX=9606 GN=TRPC6 PE=1 SV=1
Q8N6C5	Q8N6C5	CRC-7D0D2C36FD1CE8B8	query	sp|Q8N6C5|IGSF1_HUMAN Immunoglobulin superfamily member 1 OS=Homo sapiens OX=9606 GN=IGSF1 PE=1 SV=3
Q5U2N4	Q5U2N4	CRC-7D26909FB98AC34D	query	sp|Q5U2N4|MKNK2_RAT MAP kinase-interacting serine/threonine-protein kinase 2 OS=Rattus norvegicus OX=10116 GN=Mknk2 PE=2 SV=1
P20023	P20023	CRC-7D89DB4A07847E9A	query	sp|P20023|CR2_HUMAN Complement receptor type 2 OS=Homo sapiens OX=9606 GN=CR2 PE=1 SV=2
Q9NZM6	Q9NZM6	CRC-7D9FFA04542A47A4	query	sp|Q9NZM6|PK2L2_HUMAN Polycystic kidney disease 2-like 2 protein OS=Homo sapiens OX=9606 GN=PKD2L2 PE=2 SV=2
P34741	P34741	CRC-7DA4159D54741054	query	sp|P34741|SDC2_HUMAN Syndecan-2 OS=Homo sapiens OX=9606 GN=SDC2 PE=1 SV=2
O08674	O08674	CRC-7DEBBEA37EAAEAF4	query	sp|O08674|RBPJL_MOUSE Recombining binding protein suppressor of hairless-like protein OS=Mus musculus OX=10090 GN=Rbpjl PE=1 SV=1
Q91YM2	Q91YM2	CRC-7E13EC38257CE950	query	sp|Q91YM2|RHG35_MOUSE Rho GTPase-activating protein 35 OS=Mus musculus OX=10090 GN=Arhgap35 PE=1 SV=3
P27548	P27548	CRC-7E1AC117473672AD	query	sp|P27548|CD40L_MOUSE CD40 ligand OS=Mus musculus OX=10090 GN=Cd40lg PE=1 SV=2
P43351	P43351	CRC-7E1BBCAF0B9CD4AF	query	sp|P43351|RAD52_HUMAN DNA repair protein RAD52 homolog OS=Homo sapiens OX=9606 GN=RAD52 PE=1 SV=1
Q10570	Q10570	CRC-7E1DF4D8A93487A4	query	sp|Q10570|CPSF1_HUMAN Cleavage and polyadenylation specificity factor subunit 1 OS=Homo sapiens OX=9606 GN=CPSF1 PE=1 SV=2
Q06265	Q06265	CRC-7E27322F094ED3F3	query	sp|Q06265|EXOS9_HUMAN Exosome complex component RRP45 OS=Homo sapiens OX=9606 GN=EXOSC9 PE=1 SV=3
P57730	P57730	CRC-7E74C74263367101	query	sp|P57730|CAR18_HUMAN Caspase recruitment domain-containing protein 18 OS=Homo sapiens OX=9606 GN=CARD18 PE=1 SV=1
Q96IZ0	Q96IZ0	CRC-7E7515455402DBF8	query	sp|Q96IZ0|PAWR_HUMAN PRKC apoptosis WT1 regulator protein OS=Homo sapiens OX=9606 GN=PAWR PE=1 SV=1
P52205	P52205	CRC-7E82B59B7CD0E02D	query	sp|P52205|ROM1_BOVIN Rod outer segment membrane protein 1 OS=Bos taurus OX=9913 GN=ROM1 PE=1 SV=2
O00220	O00220	CRC-7E96619D0BDC0CD4	query	sp|O00220|TR10A_HUMAN Tumor necrosis factor receptor superfamily member 10A OS=Homo sapiens OX=9606 GN=TNFRSF10A PE=1 SV=3
Q13485	Q13485	CRC-7EE3C4647712DA90	query	sp|Q13485|SMAD4_HUMAN Mothers against decapentaplegic homolog 4 OS=Homo sapiens OX=9606 GN=SMAD4 PE=1 SV=1
P29353	P29353	CRC-7EFA5CB185A548D1	query	sp|P29353|SHC1_HUMAN SHC-transforming protein 1 OS=Homo sapiens OX=9606 GN=SHC1 PE=1 SV=4
Q62108	Q62108	CRC-7EFFC99E1FFF90BA	query	sp|Q62108|DLG4_MOUSE Disks large homolog 4 OS=Mus musculus OX=10090 GN=Dlg4 PE=1 SV=1
P61027	P61027	CRC-7F02B8E8E46EE1E8	query	sp|P61027|RAB10_MOUSE Ras-related protein Rab-10 OS=Mus musculus OX=10090 GN=Rab10 PE=1 SV=1
Q14696	Q14696	CRC-7F0D796A3CC4E339	query	sp|Q14696|MESD_HUMAN LRP chaperone MESD OS=Homo sapiens OX=9606 GN=MESD PE=1 SV=2
Q01814	Q01814	CRC-7F10221B7B9AC3A2	query	sp|Q01814|AT2B2_HUMAN Plasma membrane calcium-transporting ATPase 2 OS=Homo sapiens OX=9606 GN=ATP2B2 PE=1 SV=2
Q9SRH5	Q9SRH5	CRC-7F33F53E56E9765C	query	sp|Q9SRH5|VDAC1_ARATH Mitochondrial outer membrane protein porin 1 OS=Arabidopsis thaliana OX=3702 GN=VDAC1 PE=1 SV=3
P51449	P51449	CRC-7F423140BD7922BE	query	sp|P51449|RORG_HUMAN Nuclear receptor ROR-gamma OS=Homo sapiens OX=9606 GN=RORC PE=1 SV=2
P31947	P31947	CRC-7F4B44E3AA59ECE6	query	sp|P31947|1433S_HUMAN 14-3-3 protein sigma OS=Homo sapiens OX=9606 GN=SFN PE=1 SV=1
P01582	P01582	CRC-7F60AC4F330D5B11	query	sp|P01582|IL1A_MOUSE Interleukin-1 alpha OS=Mus musculus OX=10090 GN=Il1a PE=1 SV=1
P35609	P35609	CRC-7F612C1C3B3E2299	query	sp|P35609|ACTN2_HUMAN Alpha-actinin-2 OS=Homo sapiens OX=9606 GN=ACTN2 PE=1 SV=1
P19793	P19793	CRC-7F952B580AD84C42	query	sp|P19793|RXRA_HUMAN Retinoic acid receptor RXR-alpha OS=Homo sapiens OX=9606 GN=RXRA PE=1 SV=1
Q39128	Q39128	CRC-7F9C8285ED702338	query	sp|Q39128|KAT1_ARATH Potassium channel KAT1 OS=Arabidopsis thaliana OX=3702 GN=KAT1 PE=1 SV=2
P54258	P54258	CRC-7FB9928DCADF9B1F	query	sp|P54258|ATN1_RAT Atrophin-1 OS=Rattus norvegicus OX=10116 GN=Atn1 PE=1 SV=1
Q02535	Q02535	CRC-7FC38B56B4DCEFBC	query	sp|Q02535|ID3_HUMAN DNA-binding protein inhibitor ID-3 OS=Homo sapiens OX=9606 GN=ID3 PE=1 SV=2
Q05193	Q05193	CRC-7FCD8CB572FFEAEF	query	sp|Q05193|DYN1_HUMAN Dynamin-1 OS=Homo sapiens OX=9606 GN=DNM1 PE=1 SV=2
Q9JM90	Q9JM90	CRC-8033C606990AAA75	query	sp|Q9JM90|STAP1_MOUSE Signal-transducing adaptor protein 1 OS=Mus musculus OX=10090 GN=Stap1 PE=1 SV=1
Q9WU42	Q9WU42	CRC-8068020DF0AAB9B7	query	sp|Q9WU42|NCOR2_MOUSE Nuclear receptor corepressor 2 OS=Mus musculus OX=10090 GN=Ncor2 PE=1 SV=3
Q68CL8	Q68CL8	CRC-80E2311F79AEE457	query	tr|Q68CL8|Q68CL8_9TRYP 14-3-3 protein II OS=Trypanosoma brucei OX=5691 GN=t. b. b. 14-3-3 II PE=3 SV=1
Q8K1S3	Q8K1S3	CRC-80E896F0F0E06012	query	sp|Q8K1S3|UNC5B_MOUSE Netrin receptor UNC5B OS=Mus musculus OX=10090 GN=Unc5b PE=1 SV=1
Q04206	Q04206	CRC-8147A6AF9F2445C6	query	sp|Q04206|TF65_HUMAN Transcription factor p65 OS=Homo sapiens OX=9606 GN=RELA PE=1 SV=2
Q9NV88	Q9NV88	CRC-81F1A24B99704684	query	sp|Q9NV88|INT9_HUMAN Integrator complex subunit 9 OS=Homo sapiens OX=9606 GN=INTS9 PE=1 SV=2
P48552	P48552	CRC-81FC424968E9A5F6	query	sp|P48552|NRIP1_HUMAN Nuclear receptor-interacting protein 1 OS=Homo sapiens OX=9606 GN=NRIP1 PE=1 SV=2
P15976	P15976	CRC-822BD2DE14B908AD	query	sp|P15976|GATA1_HUMAN Erythroid transcription factor OS=Homo sapiens OX=9606 GN=GATA1 PE=1 SV=1
P31269	P31269	CRC-823A1A22BB07A881	query	sp|P31269|HXA9_HUMAN Homeobox protein Hox-A9 OS=Homo sapiens OX=9606 GN=HOXA9 PE=1 SV=4
P35606	P35606	CRC-824BB63BEFAA53F6	query	sp|P35606|COPB2_HUMAN Coatomer subunit beta' OS=Homo sapiens OX=9606 GN=COPB2 PE=1 SV=2
Q8IQW0	Q8IQW0	CRC-827491ADDE5E4661	query	tr|Q8IQW0|Q8IQW0_DROME Pico, isoform B OS=Drosophila melanogaster OX=7227 GN=pico PE=4 SV=1
P41273	P41273	CRC-827551F34563E508	query	sp|P41273|TNFL9_HUMAN Tumor necrosis factor ligand superfamily member 9 OS=Homo sapiens OX=9606 GN=TNFSF9 PE=1 SV=1
P28033	P28033	CRC-827AC4AFC209AE89	query	sp|P28033|CEBPB_MOUSE CCAAT/enhancer-binding protein beta OS=Mus musculus OX=10090 GN=Cebpb PE=1 SV=1
Q8K0S5	Q8K0S5	CRC-8285A01C1250D18A	query	sp|Q8K0S5|R4RL1_MOUSE Reticulon-4 receptor-like 1 OS=Mus musculus OX=10090 GN=Rtn4rl1 PE=1 SV=1
Q7L7X3	Q7L7X3	CRC-82941DEAEADC7651	query	sp|Q7L7X3|TAOK1_HUMAN Serine/threonine-protein kinase TAO1 OS=Homo sapiens OX=9606 GN=TAOK1 PE=1 SV=1
Q9QUL6	Q9QUL6	CRC-82978187FC3E0E03	query	sp|Q9QUL6|NSF_RAT Vesicle-fusing ATPase OS=Rattus norvegicus OX=10116 GN=Nsf PE=1 SV=1
Q9Y4Y9	Q9Y4Y9	CRC-82B5C8830E64C992	query	sp|Q9Y4Y9|LSM5_HUMAN U6 snRNA-associated Sm-like protein LSm5 OS=Homo sapiens OX=9606 GN=LSM5 PE=1 SV=3
Q5TD97	Q5TD97	CRC-82C03B1EAA147C11	query	sp|Q5TD97|FHL5_HUMAN Four and a half LIM domains protein 5 OS=Homo sapiens OX=9606 GN=FHL5 PE=1 SV=1
Q42545	Q42545	CRC-82C942D597171EDB	query	sp|Q42545|FTSZ1_ARATH Cell division protein FtsZ homolog 1, chloroplastic OS=Arabidopsis thaliana OX=3702 GN=FTSZ1 PE=1 SV=2
Q5JZY3	Q5JZY3	CRC-82D60740B7B6B9BD	query	sp|Q5JZY3|EPHAA_HUMAN Ephrin type-A receptor 10 OS=Homo sapiens OX=9606 GN=EPHA10 PE=1 SV=2
P01303	P01303	CRC-832CF124321718F2	query	sp|P01303|NPY_HUMAN Pro-neuropeptide Y OS=Homo sapiens OX=9606 GN=NPY PE=1 SV=1
Q8WU20	Q8WU20	CRC-833714EE12097C75	query	sp|Q8WU20|FRS2_HUMAN Fibroblast growth factor receptor substrate 2 OS=Homo sapiens OX=9606 GN=FRS2 PE=1 SV=4
C7GKY3	C7GKY3	CRC-8370B24806510774	query	tr|C7GKY3|C7GKY3_YEAS2 Gea1p OS=Saccharomyces cerevisiae (strain JAY291) OX=574961 GN=GEA1 PE=4 SV=1
P06136	P06136	CRC-839A3D34B948CEAB	query	sp|P06136|FTSQ_ECOLI Cell division protein FtsQ OS=Escherichia coli (strain K12) OX=83333 GN=ftsQ PE=1 SV=1
P62994	P62994	CRC-83A4B0BA1B248DC4	query	sp|P62994|GRB2_RAT Growth factor receptor-bound protein 2 OS=Rattus norvegicus OX=10116 GN=Grb2 PE=1 SV=1
P01589	P01589	CRC-83D907C8C81D2C0E	query	sp|P01589|IL2RA_HUMAN Interleukin-2 receptor subunit alpha OS=Homo sapiens OX=9606 GN=IL2RA PE=1 SV=1
P27882	P27882	CRC-83DADA0DB1DF17CC	query	sp|P27882|ERV1_YEAST Mitochondrial FAD-linked sulfhydryl oxidase ERV1 OS=Saccharomyces cerevisiae (strain ATCC 204508 / S288c) OX=559292 GN=ERV1 PE=1 SV=2
Q92851	Q92851	CRC-840348AE602B8243	query	sp|Q92851|CASPA_HUMAN Caspase-10 OS=Homo sapiens OX=9606 GN=CASP10 PE=1 SV=3
Q9UPT6	Q9UPT6	CRC-84166F5725D74B25	query	sp|Q9UPT6|JIP3_HUMAN C-Jun-amino-terminal kinase-interacting protein 3 OS=Homo sapiens OX=9606 GN=MAPK8IP3 PE=1 SV=3
